{
  "$schema": "./registry.schema.json",
  "version": 1,
  "note": "Canonical entity table. See docs/registry-entity-model.md. Hand-curated via the console Entity Workspace; bootstrapped by scripts/bootstrap-registry.mjs.",
  "entities": [
    {
      "id": "arc",
      "kind": "type",
      "base": null,
      "name": "Arc",
      "family": "data",
      "intent": [
        "relationships"
      ],
      "produces": null,
      "keywords": [
        {
          "text": "arc diagram",
          "kind": "trigger"
        },
        {
          "text": "relationship chart",
          "kind": "trigger"
        },
        {
          "text": "connection arcs",
          "kind": "trigger"
        },
        {
          "text": "network arcs",
          "kind": "trigger"
        }
      ],
      "guidance": "Set `order appearance` and list links so the busiest pairs sit next to each other — heavy connections then read as short arcs hugging the axis instead of long sweeps (otherwise placement is automatic and row order is ignored). Add `layout chord` for the circular (\"chord\") layout when relationships are genuinely reciprocal and many-to-many; leave it off (linear default) for hub-and-spoke or mostly one-directional flows.",
      "description": "Network relationships"
    },
    {
      "id": "arc-chord",
      "kind": "variant",
      "base": "arc",
      "name": "Chord",
      "family": "data",
      "intent": [],
      "produces": "layout chord",
      "keywords": [],
      "guidance": null,
      "description": null
    },
    {
      "id": "arc-ordered",
      "kind": "variant",
      "base": "arc",
      "name": "Ordered",
      "family": "data",
      "intent": [],
      "produces": null,
      "keywords": [
        {
          "text": "ordered arc",
          "kind": "synonym"
        }
      ],
      "guidance": null,
      "description": null
    },
    {
      "id": "bar",
      "kind": "type",
      "base": null,
      "name": "Bar",
      "family": "data",
      "intent": [
        "compare-values"
      ],
      "produces": null,
      "keywords": [
        {
          "text": "bar chart",
          "kind": "trigger"
        },
        {
          "text": "categorical comparison",
          "kind": "trigger"
        },
        {
          "text": "bar graph",
          "kind": "trigger"
        },
        {
          "text": "revenue by region",
          "kind": "trigger"
        },
        {
          "text": "quarterly revenue",
          "kind": "trigger"
        },
        {
          "text": "quarterly sales",
          "kind": "trigger"
        },
        {
          "text": "compare revenue",
          "kind": "trigger"
        },
        {
          "text": "revenue across",
          "kind": "trigger"
        },
        {
          "text": "votes for",
          "kind": "trigger"
        },
        {
          "text": "headcount by",
          "kind": "trigger"
        },
        {
          "text": "average salary",
          "kind": "trigger"
        },
        {
          "text": "top 10",
          "kind": "trigger"
        },
        {
          "text": "sold the most",
          "kind": "trigger"
        },
        {
          "text": "for each category",
          "kind": "trigger"
        },
        {
          "text": "by category",
          "kind": "trigger"
        },
        {
          "text": "across products",
          "kind": "trigger"
        },
        {
          "text": "compare across",
          "kind": "trigger"
        },
        {
          "text": "values for each",
          "kind": "trigger"
        },
        {
          "text": "count by",
          "kind": "trigger"
        },
        {
          "text": "number of",
          "kind": "trigger"
        },
        {
          "text": "stacked bar",
          "kind": "trigger"
        },
        {
          "text": "composite bar",
          "kind": "trigger"
        },
        {
          "text": "stacked breakdown",
          "kind": "trigger"
        },
        {
          "text": "revenue by segment",
          "kind": "trigger"
        }
      ],
      "guidance": "pick the form from the question — `bar` to compare categories, `line` for a trend over time, `pie` only for parts of one whole (≤6 slices); sort bars by value unless the category order is inherent (time, size); give one highlighted series a distinct color and keep the rest neutral; always label units.",
      "description": "Categorical comparisons for 3 - 5 figures"
    },
    {
      "id": "bar-grouped",
      "kind": "variant",
      "base": "bar",
      "name": "Grouped",
      "family": "data",
      "intent": [],
      "produces": null,
      "keywords": [
        {
          "text": "grouped",
          "kind": "synonym"
        },
        {
          "text": "clustered",
          "kind": "synonym"
        },
        {
          "text": "grouped bar",
          "kind": "synonym"
        },
        {
          "text": "clustered bar",
          "kind": "synonym"
        }
      ],
      "guidance": null,
      "description": null
    },
    {
      "id": "bar-horizontal",
      "kind": "variant",
      "base": "bar",
      "name": "Horizontal",
      "family": "data",
      "intent": [],
      "produces": null,
      "keywords": [
        {
          "text": "horizontal",
          "kind": "synonym"
        },
        {
          "text": "horizontal bar",
          "kind": "synonym"
        }
      ],
      "guidance": null,
      "description": null
    },
    {
      "id": "block",
      "kind": "type",
      "base": null,
      "name": "Block",
      "family": "software",
      "intent": [
        "relationships"
      ],
      "produces": null,
      "keywords": [
        {
          "text": "block diagram",
          "kind": "trigger"
        },
        {
          "text": "block layout",
          "kind": "trigger"
        },
        {
          "text": "grid of blocks",
          "kind": "trigger"
        },
        {
          "text": "system layout",
          "kind": "trigger"
        },
        {
          "text": "architecture grid",
          "kind": "trigger"
        },
        {
          "text": "hardware layout",
          "kind": "trigger"
        },
        {
          "text": "nested blocks",
          "kind": "trigger"
        },
        {
          "text": "block-beta",
          "kind": "trigger"
        },
        {
          "text": "components grid",
          "kind": "trigger"
        }
      ],
      "guidance": "Reach for `block` when the **arrangement is the message** (system/hardware/architecture layouts) — not when you just want boxes auto-connected (that's `boxes-and-lines`/`flowchart`). Group with **containers** (indent a sub-grid) and **tag the container** so the colour cascades to its children. Don't write `columns` unless you need to override the inferred width; a lone block on a row already fills it. Mark a busy subsystem `collapsed` to keep the overview readable.",
      "description": null
    },
    {
      "id": "body",
      "kind": "type",
      "base": null,
      "name": "Body",
      "family": "life",
      "intent": [
        "part-to-whole"
      ],
      "produces": null,
      "keywords": [
        {
          "text": "anatomy",
          "kind": "trigger"
        },
        {
          "text": "human body",
          "kind": "trigger"
        },
        {
          "text": "muscle",
          "kind": "trigger"
        },
        {
          "text": "muscle groups",
          "kind": "trigger"
        },
        {
          "text": "musculature",
          "kind": "trigger"
        },
        {
          "text": "muscular system",
          "kind": "trigger"
        },
        {
          "text": "workout",
          "kind": "trigger"
        },
        {
          "text": "exercise",
          "kind": "trigger"
        },
        {
          "text": "fitness",
          "kind": "trigger"
        },
        {
          "text": "body diagram",
          "kind": "trigger"
        }
      ],
      "guidance": "Reach for `body` when the drawing IS the human figure — colour muscle groups over a skin layer to show which parts a workout targets, where an injury sits, or how the musculature is organised. Choose the figure with `male`/`female` and `front`/`back`; each named muscle group takes a tag so the legend carries the meaning. Best for fitness, medical, exercise, and educational diagrams — not for generic part-to-whole (that's `pie`/`treemap`).",
      "description": "Human anatomy figure — colorable muscle groups over a skin layer"
    },
    {
      "id": "boxes-and-lines",
      "kind": "type",
      "base": null,
      "name": "Boxes and Lines",
      "family": "freeform",
      "intent": [
        "relationships"
      ],
      "produces": null,
      "keywords": [
        {
          "text": "boxes and lines",
          "kind": "trigger"
        },
        {
          "text": "boxes and arrows",
          "kind": "trigger"
        },
        {
          "text": "nodes and edges",
          "kind": "trigger"
        },
        {
          "text": "generic diagram",
          "kind": "trigger"
        },
        {
          "text": "general-purpose network",
          "kind": "trigger"
        },
        {
          "text": "how they connect",
          "kind": "trigger"
        },
        {
          "text": "architecture diagram",
          "kind": "trigger"
        }
      ],